{
  "format": "channelshift.backend-blueprint/v1-draft",
  "project": {
    "key": "booking-service",
    "name": "예약 서비스 예시"
  },
  "source": {
    "schema_format": "channelshift.schema/v1",
    "schema_version_id": "2640921b-2902-4af7-bd48-402f40e59a46",
    "digest": {
      "algorithm": "sha256",
      "canonicalization": "channelshift-local-python-json/v1",
      "value": "43d64adc1fc0887e5a3978ed2a1f05ba3801507d8105b9d10e0cfeeaedda844e"
    }
  },
  "target": {
    "language": "java",
    "framework": "spring_boot",
    "database": "postgresql",
    "orm": "jakarta_jpa",
    "migrations": "flyway",
    "readiness": "proposed"
  },
  "profile": {
    "id": "web-java-jpa",
    "version": "0.1.0-draft"
  },
  "requirements": {
    "auth": "oidc",
    "tenancy": "workspace",
    "commands": [
      {
        "id": "create_booking",
        "transaction": "required",
        "idempotency": "required",
        "authorization": "server_verified_workspace_membership",
        "invariants": [
          "고객·서비스·예약은 같은 작업공간에 속한다.",
          "편집 권한이 있는 구성원만 예약을 생성한다.",
          "수용량 1인 서비스의 같은 시간대에 유효 예약이 중복되지 않는다.",
          "같은 멱등 키와 요청은 같은 결과를 반환하고, 다른 요청 내용이면 충돌로 처리한다."
        ]
      },
      {
        "id": "list_bookings",
        "transaction": "read_only",
        "idempotency": "not_applicable",
        "authorization": "server_verified_workspace_membership",
        "invariants": [
          "인증된 계정이 열람 가능한 작업공간의 예약만 반환한다.",
          "페이지 크기 상한을 서버에서 적용한다."
        ]
      }
    ],
    "api": [
      {
        "method": "POST",
        "path": "/workspaces/{workspaceId}/bookings",
        "command": "create_booking",
        "access": "workspace_member"
      },
      {
        "method": "GET",
        "path": "/workspaces/{workspaceId}/bookings",
        "command": "list_bookings",
        "access": "workspace_member"
      }
    ]
  },
  "overrides": [
    {
      "path": "/naming/javaPackage",
      "value": "net.channelshift.booking",
      "reason": "프로젝트의 Java 패키지 규칙에 맞춘다."
    },
    {
      "path": "/pagination/defaultPageSize",
      "value": 30,
      "reason": "예약 관리 화면의 기본 목록 크기다."
    },
    {
      "path": "/api/basePath",
      "value": "/api/v1",
      "reason": "API 변경 버전을 경로에서 구분한다."
    },
    {
      "path": "/transactions/isolation",
      "value": "read_committed",
      "reason": "기존 DB 기본 수준을 유지한다. 예약 경합은 별도 제약·잠금과 동시성 검사로 다룬다."
    }
  ],
  "evidence": {
    "status": "planned",
    "stages": [
      "schema_validation",
      "blueprint_validation",
      "generation",
      "compile",
      "authorization_tests",
      "migration_test",
      "deployment_receipt"
    ]
  },
  "ledger": {
    "phases": [
      {
        "kind": "design_provenance",
        "status": "planned"
      },
      {
        "kind": "business_ledger",
        "status": "planned",
        "source_record_access": false
      }
    ]
  }
}
